,date,text,user_followers,user_favourites,Compound,Open,Close,Volume
0,2021-04-07,"when supply is more than demand, what happens?   💸💵📉 

 bitcoin is the best way to hedge against this fiat/dollar… ",147300.0,16909.0,0.5302,58186.507813,56048.9375,75645303584
1,2021-04-06,time to step up your crypto game with gk! check this out tomorrow as we make ria history! launching the first indiv… ,142460.0,68708.0,0.0,59171.93359400001,58192.359375,66058027988
2,2021-04-06,we believe that businesses built on  bitcoin should also mine to support the network’s security.  blockstreammining… ,139926.0,13256.0,0.6249,59171.93359400001,58192.359375,66058027988
3,2021-04-05,jpmorgan has revised its  bitcoin price target to  130k. the bank says  btc has become more appealing to institutio… ,978164.0,10105.0,0.0,58760.875,59057.87890599999,60706272115
4,2021-04-05,"host of ,  joins  for a look at everything from the philosophical &amp;… ",224316.0,13691.0,0.0,58760.875,59057.87890599999,60706272115
5,2021-04-24,"bitcoin has fallen over 19% in the past week below  50,000 from its highs after coinbase went public earlier this month.

will investors look to buy the dip in bitcoin and other cryptocurrencies?
 btc  bitcoin  ethereum  crypto  cryptocurrency  doge ",777224.0,10339.0,-0.3612,51143.226563,50050.867188,49014494781
6,2021-04-24,bitcoin attack: can bitcoin be taken down now with just 7 billion dollars? breaking  bitcoin [2021]   btc ,581890.0,13494.0,-0.4767,51143.226563,50050.867188,49014494781
7,2021-04-23,"dow futures turn lower, bitcoin below  50,000 on biden tax hike concerns


 bitcoin  btc",777224.0,10339.0,-0.296,51739.808594,51093.652344,86668667320
8,2021-04-22,"when institutions want you to sell your  bitcoin to them, they share "" bearish"" news/opinions.

always ""keep calm &amp;  hodl ftw!""

remember, there's literally only ever going to be 21-mil  btc in total.  limited

    crypto",148618.0,16986.0,0.7095,53857.10546900001,51762.273438,74798630778
9,2021-04-22,"the most recent time eth outperformed  btc like this was in january after  bitcoin had put in an interim top ... it then dropped in relative value by 33%

the last *two* times eth fans dared  talk about 'flippening' btc, eth went on to lose &gt;80% in relative value vs bitcoin",86685.0,7017.0,0.6597,53857.10546900001,51762.273438,74798630778
10,2021-04-22,"that theory that  ethereum is the better long term investment than  bitcoin is backing those folks right now as  btc consolidates  quicksand style, meanwhile  eth is flexing better than all  altcoins. ",96926.0,33651.0,0.7096,53857.10546900001,51762.273438,74798630778
11,2021-04-21,"jackson tennessee's mayor pushing to adopt  bitcoin. the city is exploring mining  btc and keeping it on its balance sheet.
",777227.0,10339.0,0.1779,56471.12890599999,53906.08984400001,54926612466
12,2021-04-21,"""wework will accept  bitcoin ( btc),  ethereum ( eth), usd coin (usdc), paxos (pax), and several other cryptocurrencies as payment for its offerings,"" the softbank-backed company says. ",1053661.0,10096.0,0.3818,56471.12890599999,53906.08984400001,54926612466
13,2021-04-20,"coinbase’s number of monthly transacting users has skyrocketed to over 6m. its customers held  223bn in accounts, more than a tenth of the total value of cryptocurrencies   bitcoin  btc ",252557.0,22831.0,0.4576,55681.79296900001,56473.03125,67849323955
14,2021-04-19,"""the call"" recap | financials analyst josh steiner on crypto &amp;  ma  via   bitcoin  btc",197470.0,18271.0,0.0,56191.585938,55724.265625,65344865159
15,2021-04-19,"remember last year when it felt like  bitcoin was stuck at  10k for eternity?

the spring is coiling up. the longer we consolidate, the bigger the explosion will be. 📈💥🚀

just be patient &amp; let those weak-hands keep selling to strong-hands.

 bear  bearish  bull  bullish  btc ",148624.0,16986.0,-0.25,56191.585938,55724.265625,65344865159
16,2021-04-19,"despite the majority of fund managers surveyed seeing  bitcoin as a bubble, about 10% said they think  btc will outperform in 2021.  boa  cryptocurrency ",1053758.0,10096.0,0.0,56191.585938,55724.265625,65344865159
17,2021-04-18,"the  coin direct list played perfectly into the old adage, buy rumor, sell news. i'm sure neither of us can fault brian   for taking some chips off the table.  bitcoin  btc ",260339.0,12669.0,0.7351,60701.88671900001,56216.18359400001,97468872758
18,2021-05-29,"buy the dip 😀... and dip 🙂... and dip 😐.. and dip ... and di 🙄... and d 🤔... 

meanwhile there's a party at the 🐳whales' house🐳

 bitcoin  btc  cryptocurrency  cryptocurrencynews   btcnews  bitcoinnews  hold  holders  whalealert  wales  etherum  ether  eth  nft",94387.0,13850.0,0.785,35684.15625,34616.066406,45231013335
19,2021-05-29,"icymi

🇸🇬  singapore sovereign wealth fund  temasek has been buying  bitcoin since 2018

is your country missing out?

time to speak out as a citizen for your own country  federalreserve to review  btc asap 💪

    crypto  cbdc ",148911.0,17099.0,0.25,35684.15625,34616.066406,45231013335
20,2021-05-29,what’s going on with  btc  bitcoin  crypto ??? madness,294151.0,117122.0,-0.533,35684.15625,34616.066406,45231013335
21,2021-05-28,"whales 🐳🐳🐳🐳🐳 at party...
 bitcoin  whalealert  whales  btc  crypto  cryptocurrency  cryptocurrencies  ethereum",94387.0,13850.0,0.4019,38507.082031,35697.605469,55200191952
22,2021-05-28,the question is why do whales 🐳 keep pushing  bitcoin 's low price? my theory is that they also want some altcoins and especially ethereum which has remained steady and does not fall in prices that was at the beginning of the year so they insist what do you guys think?  eth  btc,94387.0,13850.0,-0.2869,38507.082031,35697.605469,55200191952
23,2021-05-28,"it's true but in the cryptocurrency market today there are many whales 🐳🐳🐳 making the party by manipulating prices and holding the value of  bitcoin when they stop, go to the  moon !
 btc 🚀  whales  whale  crypto  cryptocurrency  cryptocurrencies  ethereum  ethereum  hodl",94387.0,13850.0,0.4199,38507.082031,35697.605469,55200191952
24,2021-05-28,"all of this is just a whale 🐳🐳🐳 party my friend.

 bitcoin  btc  cryptonews  cryptotrading  whalealert  whales  whale  eth   ethereum  crypto",94387.0,13850.0,0.7096,38507.082031,35697.605469,55200191952
25,2021-05-28,"whales 🐳🐳🐳, whales 🐳🐳🐳 and... whales🐳🐳🐳
 bitcoin  btc  cryptonews  cryptocurrencies  cryptocurrency  crypto  ethereum  eth  whalealert  whale  whaleplay",94387.0,13850.0,0.0,38507.082031,35697.605469,55200191952
26,2021-05-28,"bitcoin remains in uncertainty because of the whales 🐳🐳🐳 that shamelessly manipulate the market. with dollar inflation forecasts, the  btc should be valued. but whales 🐳🐳🐳 don't allow it. it should be an independent market, but it is not.  cryptonews",94387.0,13850.0,-0.3504,38507.082031,35697.605469,55200191952
27,2021-05-28,there are many interests behind this recent attack on  bitcoin.  and the whales 🐳🐳🐳 continue to rule the game. whales are not letting up.  they probably want to buy more in the dip...  btc  bitcoinnews  crypto  cryptocurrency  crypronews  cryptocurrencies  bitcoiners  hodl,94387.0,13850.0,-0.2023,38507.082031,35697.605469,55200191952
28,2021-05-28,you have been a key figure for the crypto community!  congratulations for the brilliant performance!  bitcoin  btc  crypto  cryptocurrency  cryptocurrencies  bitcoins  bitcoinnews  hodl  hodlers,94387.0,13850.0,0.8513,38507.082031,35697.605469,55200191952
29,2021-05-27,"this is amazing news! 👏👏

shoutout to  paypal!

 

  bitcoin  crypto  cryptocurrency  news ca spain  _br uk   4business  btc",148915.0,17099.0,0.658,39316.890625,38436.96875,43210968721
30,2021-05-27,"to answer your qn  2
 cbdc will serve as an on-ramp &amp; off-ramp for  cryptocurrency, more specifically  bitcoin; to hedge against volatility, etc.

  btc is already being used across the world, the trillion dollar market cap is proof of that.",148915.0,17099.0,0.0,39316.890625,38436.96875,43210968721
31,2021-05-27,"country's own national reserve of  bitcoin

e.g. usa - 

this is separate from company's own or the people's own personal  bitcoins

that said, organisations now stand a chance to possibly become more powerful than even a country's govt too, if they own more  btc",148914.0,17099.0,0.624,39316.890625,38436.96875,43210968721
32,2021-05-27,"the amount of  bitcoin in the country's reserves will determine the strength/influence of the country's own currency, as it transits into  digitalcurrency 💰🏦

the country/organization with the most  btc will rule the world 🌎 

 cbdc  goldrush  economics  cryptocurrency  crypto",148914.0,17099.0,0.0,39316.890625,38436.96875,43210968721
33,2021-05-26,"the  crypto market over the next 12-24 months will grow without the dependence of  bitcoin. great companies/coins will grow without the need for  btc to lead the way.

 ada  ethereum and as you can see  matic will grow regardless what bitcoin does.  cryptobro ",96201.0,33770.0,0.6249,38392.625,39294.199219,51346735160
34,2021-05-25,""" btc’s price will likely remain volatile until we exceed the market cap of gold. also, there are likely going to be new  bitcoin-focused financial products coming to market that will reduce volatility and gyrations."" -   blockstreamfinance ",148477.0,13838.0,0.0,38795.78125,38402.222656,56211915803
35,2021-06-23,"stock market today:  has a bit of important advice for investors who are short the meme stocks. 

he also leans toward  ethereum over  bitcoin
",786675.0,11356.0,0.2023,32515.714844,33723.027344,46317108925
36,2021-06-23,"the reaction when  bitcoin finally breaks below the range and immediately bounces. 

watch until the end. ",486343.0,89796.0,0.0,32515.714844,33723.027344,46317108925
37,2021-06-23,bitcoin exchange  is now an official sponsor of major league baseball! ⚾ ,1111558.0,14427.0,0.0,32515.714844,33723.027344,46317108925
38,2021-06-23,". claims that by using  bitcoin, instead of trad'l remittance transfer services,  elsalvador will save billions. this statement is factually unhinged. elsl's remittance costs are the 6th lowest in the world &amp; the lowest in latam () ",337896.0,6777.0,-0.25,32515.714844,33723.027344,46317108925
39,2021-06-23,"china's  bitcoin mining crackdown has led to bitmain halting mining rig sales, exodus of miners and decline in the hash rate.

covered by :

",1111560.0,14427.0,-0.128,32515.714844,33723.027344,46317108925
40,2021-06-23,". breaks down how a combination of elon musk's twitter antics, tribalism, greed, speculation and a general lack of  crypto knowledge led to  bitcoin's price getting cut in half. 
",786676.0,11356.0,-0.7269,32515.714844,33723.027344,46317108925
41,2021-06-23,"""if it needed more help than square and twitter, i would leave them for  bitcoin."" -  ",1111560.0,14427.0,0.4201,32515.714844,33723.027344,46317108925
42,2021-06-22,"minneapolis fed president neel kashkari calls doge a ponzi scheme 



 bitcoin  blockchain  banking  cash  fintech  finance  future  cryptocurrency ",492894.0,19938.0,0.0,31622.376952999995,32505.660156,58964353058
43,2021-06-22,jim cramer has sold his  bitcoin now we can pump,492325.0,106987.0,0.0,31622.376952999995,32505.660156,58964353058
44,2021-06-22,“ bitcoin was designed to be protected from the influence of charismatic leaders.” —satoshi nakamoto,134470.0,21688.0,0.4404,31622.376952999995,32505.660156,58964353058
45,2021-06-22,bitcoin steadies in  asia trading after monday's plunge ,106211.0,35876.0,0.0,31622.376952999995,32505.660156,58964353058
46,2021-06-22,"these two risk factors could delay bitcoin bull market: on-chain analyst willy woo

 

 bitcoin  blockchain  banking  cash  fintech  finance  future  cryptocurrency ",492895.0,19938.0,-0.0772,31622.376952999995,32505.660156,58964353058
47,2021-06-22,"el salvador - the whole story with jack mallers — 

what bitcoin did 

 bitcoin  blockchain  banking  cash  fintech  finance  future  cryptocurrency ",492895.0,19938.0,0.0,31622.376952999995,32505.660156,58964353058
48,2021-06-22,"facebook's david marcus, who is in charge of diem, formerly libra, believes that the chinese government cracking down on  bitcoin mining is ""a great development"" for btc.  cryptocurrency. ",1444373.0,10093.0,0.6249,31622.376952999995,32505.660156,58964353058
49,2021-06-22,"bitcoin price can hit  450k in 2021,  135k is ‘worst-case scenario’  



 bitcoin  blockchain  banking  cash  fintech  finance  future  cryptocurrency ",492895.0,19938.0,0.0,31622.376952999995,32505.660156,58964353058
50,2021-06-22,"big  bitcoin  player buys the  dip 

while  china  crackdown widens 

  fintech  crypto       ",110350.0,192509.0,0.0,31622.376952999995,32505.660156,58964353058
51,2021-06-22,"cramer has lettuce 🥬 hands.

 bitcoin",398607.0,64436.0,0.0,31622.376952999995,32505.660156,58964353058
52,2021-06-22,"a  130 million  crypto  quant 

nets big  returns as  options boom 

  fintech  bitcoin   ",110350.0,192509.0,0.0,31622.376952999995,32505.660156,58964353058
53,2021-06-22,"elon musk and china won't stop bitcoin from hitting  135,000 this year, says famed crypto analyst



 bitcoin  blockchain  banking  cash  fintech  finance  future  cryptocurrency ",492895.0,19938.0,0.2235,31622.376952999995,32505.660156,58964353058
54,2021-06-22,"this  bitcoin atm in el salvador dispenses no cash. one day, it won't need a sign ✊ ",1111705.0,14427.0,-0.296,31622.376952999995,32505.660156,58964353058
55,2021-06-22,"good question. 

i still have troble getting the landlord to take  btc and the grocery is also problematic at present. 

while i don't think  bitcoin will be easier to spend than a gold brick anytime soon, i see us doing digital transaction in  crypto as a norm.",492895.0,19938.0,0.4215,31622.376952999995,32505.660156,58964353058
56,2021-06-22,you will want to watch this.  bitcoin ,267077.0,13203.0,0.0772,31622.376952999995,32505.660156,58964353058
57,2021-06-22,"you’d be crazy to spend your  bitcoin,  ethereum, or  dogecoin 

with  coinbase’s  debitcard 

  fintech  crypto  ",110350.0,192509.0,-0.34,31622.376952999995,32505.660156,58964353058
58,2021-06-22,"chinese logistics firm 

 airlifting  bitcoinmining machines to  maryland: report 

  fintech  china  crypto  blockchain  bitcoin   ",110350.0,192509.0,0.0,31622.376952999995,32505.660156,58964353058
59,2021-06-22,"russian billionaire oleg deripaska urges bank of russia to move to bitcoin 



 russia  bankofrussia  banking  billionaire  deripaska  bitcoin  russianbillionaire  olegderipaska ",492895.0,19938.0,0.0,31622.376952999995,32505.660156,58964353058
60,2021-06-22,"the chinese government is next level... if they are shutting down  bitcoin mining, there is a strategic, and likely stealthy, reason. 

what do you think that reason is? 

all theories welcome! [ h/t  on the tweet below, which i can not verify ] ",434562.0,93253.0,0.4926,31622.376952999995,32505.660156,58964353058
61,2021-06-22,"jim cramer has sold almost all of his  bitcoin, citing the chinese government's crackdown on bitcoin  mining and  ransomware attacks.  cryptocurrency ",1444382.0,10093.0,-0.4404,31622.376952999995,32505.660156,58964353058
62,2021-06-21,"bitcoin and  cryptocurrency talk. 🔥🌋

 ",398606.0,64436.0,-0.34,35641.144531,31676.693358999997,52809038594
63,2021-06-21,will asia help  bitcoin rises?,398606.0,64436.0,0.4019,35641.144531,31676.693358999997,52809038594
64,2021-06-21,what happened to  bitcoin?,398606.0,64436.0,0.0,35641.144531,31676.693358999997,52809038594
65,2021-06-21,"why i bought  bitcoin as a gen z.

""we’re holding money that is devaluing while the prices of things we wish to acquire skyrocket. double rekt.""

written by .

",1111719.0,14427.0,0.4019,35641.144531,31676.693358999997,52809038594
66,2021-06-21,"bitcoin needs to hold above  30,000.",398612.0,64436.0,0.0,35641.144531,31676.693358999997,52809038594
67,2021-06-21,"seem a little one-sided?
retail smashing market sell while smart money places bids &amp; waits?
 bitcoin ",100549.0,7396.0,0.4696,35641.144531,31676.693358999997,52809038594
68,2021-06-21,"""this is totally new and different and it's the first genuinely new asset class in about 150 years ... it has tremendous investment opportunities.""  bitcoin  cryptocurrency ",1444414.0,10093.0,0.6573,35641.144531,31676.693358999997,52809038594
69,2021-06-21,"amid volatile price action in  bitcoin,  is advising caution ahead.
",786697.0,11359.0,0.0,35641.144531,31676.693358999997,52809038594
70,2021-06-21,while the masses fall in line with laser eyes to indicate they are into  bitcoin i will pioneer the next big thing.   newprofilepic ,672622.0,43977.0,0.0,35641.144531,31676.693358999997,52809038594
71,2021-06-21,"in this episode of bitcoin magazine’s ""meet the taco plebs,""  sat down with the pleb , to discuss his  bitcoin rabbit hole story, his thoughts on bitcoin’s impact on life and his future price predictions.

 ",1111727.0,14427.0,0.0,35641.144531,31676.693358999997,52809038594
72,2021-06-21,"how  bitcoin improves financial access and inclusion.

""bitcoin is a digital asset that is more nimble and better designed to meet the needs of unbanked people than the old institutions that failed them.""

written by .

",1111728.0,14427.0,0.6326,35641.144531,31676.693358999997,52809038594
73,2021-06-21,"💰the  420k giveaway is on! 💰 

we’re celebrating the addition of  doge on sofi invest by giving out a total of  420,000 in cash. get in on the action (and get  10 in  bitcoin too) when you make your first crypto trade! →  ",122259.0,11402.0,0.7707,35641.144531,31676.693358999997,52809038594
74,2021-06-21,". purchased an additional  489 million more worth of  bitcoin bringing the company’s total to 105,085  btc! 

",446589.0,6518.0,0.358,35641.144531,31676.693358999997,52809038594
75,2021-06-21,"""you can not trust the people who decide what monetary freedom means. the people who should make the decisions are you."" -  on  bitcoin ",1111729.0,14427.0,0.3607,35641.144531,31676.693358999997,52809038594
76,2021-06-21,"stock market today:  says  bitcoin faces multiple headwinds as china turns more hostile towards  crypto.
",786697.0,11359.0,-0.4391,35641.144531,31676.693358999997,52809038594
77,2021-06-21,"keep calm &amp; hodl on.

one of  bitcoin best attributes is its anti-fragility. but remember that doesn’t mean it’s not going to be volatile. it’s what it is. just gotta go with the flow 

nfa

nfa ",212433.0,8491.0,0.5023,35641.144531,31676.693358999997,52809038594
78,2021-06-21,"for anyone worried about short term price action on  bitcoin,  its worth pointing out that it wouldn't be the best asymmetric bet of your lifetime.... if everyone else saw what was coming.

being early ensures being misunderstood by the majority.",229342.0,9188.0,-0.7243,35641.144531,31676.693358999997,52809038594
79,2021-06-21,"drop fiat, adopt  bitcoin ",1111741.0,14427.0,-0.1027,35641.144531,31676.693358999997,52809038594
80,2021-06-21,"we need  bitcoin. 

don’t focus on the maxi’s.",398610.0,64436.0,0.0,35641.144531,31676.693358999997,52809038594
81,2021-06-21,"typical  bitcoin dips are 50-75% (correct?), so we are at ~50% &amp; the  15-16k level would be rock bottom according to 75% pull back

of course, history means nothing when it comes to alchemy money... could go to  100k or to  1k

 tether and  chinabanscrypto are obvious headwinds",434564.0,93253.0,0.0,35641.144531,31676.693358999997,52809038594
82,2021-06-21,"what is a  btc  bitcoin death cross? 

moon or bust with , , &amp; 
full show:  ",176953.0,8995.0,-0.5994,35641.144531,31676.693358999997,52809038594
83,2021-06-21,"watch what they do, not what they say: wall street  bitcoin adoption is accelerating 👀 ",1111746.0,14427.0,0.0,35641.144531,31676.693358999997,52809038594
84,2021-06-21,"watch moon or bust and talk about  doge  dogecoin with ! 
also: what is a  bitcoin death cross?  xrp, and china

, , &amp;  
live at 2pm et
🚀🚀",176953.0,8995.0,-0.636,35641.144531,31676.693358999997,52809038594
85,2021-06-21,bitcoin mining firm  has received approval for listing on the nasdaq capital markets exchange 📈,1111748.0,14427.0,0.4767,35641.144531,31676.693358999997,52809038594
86,2021-06-21,interesting data given that sec rejected the latest  bitcoin etf last week. ,97573.0,9280.0,-0.1531,35641.144531,31676.693358999997,52809038594
87,2021-06-21,"expect 'rocky' price action in  bitcoin? 

here's what  is watching: ",786696.0,11359.0,0.0,35641.144531,31676.693358999997,52809038594
88,2021-06-21,"on the bright side, not seeing many people talking about the nonexistent correlation between  bitcoin and stocks.",486345.0,89797.0,0.4404,35641.144531,31676.693358999997,52809038594
89,2021-06-21,"few people explain  bitcoin with more depth and accessibility than , author of the bullish case for bitcoin. here's my  q&amp;a with him from  bitcoinmiami. ",101792.0,48134.0,0.0,35641.144531,31676.693358999997,52809038594
90,2021-06-21,"i believe the future of money is in  crypto and  bitcoin is paving the way for it... more countries like  elsalvador should come forward for adoption.
 ",690119.0,7121.0,0.4173,35641.144531,31676.693358999997,52809038594
91,2021-06-21,venezuelan authorities seized more than 400  bitcoin  miners last week. ,1444449.0,10093.0,0.0,35641.144531,31676.693358999997,52809038594
92,2021-06-21,the canadian elite basketball league will allow players to receive portions of their salaries in  bitcoin,1111751.0,14427.0,0.2263,35641.144531,31676.693358999997,52809038594
93,2021-06-21,i don't believe the bearish market especially with the news from  china would reduce the faith in  crypto. there is a huge future ahead with countries adopting  bitcoin like how el salvador and other countries have. myself?  hodl  ,690119.0,7121.0,0.765,35641.144531,31676.693358999997,52809038594
94,2021-06-21,"sotheby’s to accept  crypto 

for rare 100-carat  diamond in upcoming  auction 

  fintech   nft  bitcoin  ether  ethereum   ",110350.0,192509.0,0.6124,35641.144531,31676.693358999997,52809038594
95,2021-06-21,should we attack  bitcoin? is it bitcoin or  bitcoins? fractional  bitcoining? [2021]  ,611267.0,13567.0,-0.5632,35641.144531,31676.693358999997,52809038594
96,2021-06-21,"the ""right"" as well.  bitcoin is not political. 
it is truth and freedom.",229343.0,9188.0,0.8225,35641.144531,31676.693358999997,52809038594
97,2021-06-21,michael thanks you for selling him your cheap  bitcoin ,314177.0,8273.0,0.4404,35641.144531,31676.693358999997,52809038594
98,2021-06-21,". &amp;  will be hosting a night of live comedy, music and  bitcoin celebration called the “f*ck elon tour” on july 8

we will be live streaming the show and giving away four tickets to the upcoming bitcoin 2022 conference to attendees

",1111767.0,14427.0,0.5994,35641.144531,31676.693358999997,52809038594
99,2021-06-21,"the community is depressed, the news cycle as bearish and full of fud... and  btc is still above support (for now).

my thoughts on the  bitcoin chart, the insane news cycle and the mentality of humans.

",486353.0,89797.0,-0.6597,35641.144531,31676.693358999997,52809038594
100,2021-06-21,"not sure if anyone is paying attention, but this is the same reason the ant financial ipo was pulled. an open monetary network like  bitcoin redistributes power away from the state to the people. 

imagine what society would look like without it. ",229345.0,9188.0,0.7201,35641.144531,31676.693358999997,52809038594
101,2021-06-21,"did you know  cryptocurrency has a carbon footprint? 

as pressure mounts, see how  chinese  bitcoin miners plan to go green. 

 ",286628.0,9044.0,-0.296,35641.144531,31676.693358999997,52809038594
102,2021-06-21,not everyone was impressed with microstrategy’s  bitcoin buy announcement and a few people like peter schiff made snide comments. ,1444480.0,10093.0,-0.0139,35641.144531,31676.693358999997,52809038594
103,2021-06-21,"excited to join  on   at the top of the hour (noon et) to talk about  bitcoin and china

tl;dr - the most liquid trade pair is btc / usdt - for good reason. most trading is done crypto to crypto, and doesn't touch the banking system. 

iykyk",190123.0,47540.0,0.8074,35641.144531,31676.693358999997,52809038594
104,2021-06-21,"6. what is taproot and why is it important to  bitcoin? because the taproot upgrade for bitcoin would allow smart contracts.

written by mudrex: ",267080.0,13203.0,0.6597,35641.144531,31676.693358999997,52809038594
105,2021-06-21,today is the day!  amazing bitcoin collection 2011 art piece is available for purchase! only 21 of these will ever be minted. it goes live at 20:11 edt (8:11 pm edt) at   nft  bitcoin  ,672618.0,43977.0,0.658,35641.144531,31676.693358999997,52809038594
106,2021-06-21,"michael saylor just bought the dip. 

 bitcoin",398618.0,64436.0,0.0,35641.144531,31676.693358999997,52809038594
107,2021-06-21,"here are some indian startups and exchange platforms where you can trade digital assets like  bitcoin, ethereum, dogecoin, and matic, among other altcoins.

     

",258574.0,34176.0,0.4939,35641.144531,31676.693358999997,52809038594
108,2021-06-21,"it is virtually impossible to stop  bitcoin a free and open monetary network. 
and also understand why a government that is against individual rights and freedoms would want to because it robs them of their domain over people.",229345.0,9188.0,0.1531,35641.144531,31676.693358999997,52809038594
109,2021-06-21,"-  bitcoin plunges as one of china’s biggest banks bans  crypto transactions.

-  ravn soars on a  2.1 billion offer from  cnhi.

- stocks aim for a rebound after hawkish fed comments last week.

 breaks down what thestreet is watching today! ",786694.0,11359.0,0.0,35641.144531,31676.693358999997,52809038594
